{
  "$schema": "../../../docs/schema/song.schema.json",
  "slug": "{{slug}}",
  "title": "{{title}}",
  "artist": "{{artist}}",
  "languages": ["en"],
  "duration": 1,
  "palette": {
    "accent": "#3A5BA0",
    "accentDark": "#8FB2FF",
    "field": ["#3A5BA0", "#7C4DBA", "#2A8C8C"]
  },
  "audio": { "status": "missing" },
  "timing": { "status": "draft", "method": "none" },
  "review": [
    "Опознать запись: версия, место, дата, длительность. Код языка en в заготовке — заглушка, замените на языки, которые реально поются.",
    "Палитра в заготовке — заглушка. Замените её цветами обложки, когда обложка будет. До этого цвета по настроению не подбирайте.",
    "Получить файл записи от владельца. С YouTube не скачивать.",
    "Собрать canon.md по источникам и записать последовательность."
  ]
}
