{
  "$schema": "../../../docs/schema/song.schema.json",
  "slug": "karitas",
  "title": "Karitas",
  "artist": "Sami Yusuf",
  "featuring": [
    "Cappella Amsterdam",
    "Amsterdam Andalusian Orchestra"
  ],
  "release": {
    "album": "When Paths Meet (Live at The Holland Festival)",
    "year": 2023
  },
  "performance": {
    "event": "Holland Festival",
    "venue": "Het Concertgebouw",
    "city": "Amsterdam",
    "date": "2022-06-06"
  },
  "languages": [
    "az",
    "la",
    "ar"
  ],
  "poets": [
    {
      "name": "Мухаммед Физули",
      "lang": "az",
      "era": "XVI в."
    },
    {
      "name": "Хильдегарда Бингенская",
      "lang": "la",
      "era": "XII в."
    },
    {
      "name": "Абу-ль-Хасан аш-Шуштари",
      "lang": "ar",
      "era": "XIII в."
    },
    {
      "name": "Абд аль-Гани ан-Набулси",
      "lang": "ar",
      "era": "XVII–XVIII вв."
    }
  ],
  "duration": 977.05,
  "palette": {
    "accent": "#9C2F55",
    "accentDark": "#E58DAE",
    "field": [
      "#B95876",
      "#872A4B",
      "#54182D",
      "#E7B2C9"
    ]
  },
  "coverGlyph": "Karitas",
  "audio": {
    "status": "ready",
    "high": "/audio/karitas/high.m4a",
    "peaks": "/audio/karitas/peaks.json",
    "gainDb": -1.1,
    "provenance": {
      "kind": "file",
      "ref": "Файл от пользователя (Telegram-бот); дорожка YouTube 140 официального видео https://www.youtube.com/watch?v=xWwMzfGVikA",
      "retrieved": "2026-10-16",
      "codec": "aac lc 128k 44.1kHz stereo",
      "sha256": "ec056c74c5e1dbeb75409a0a13684030bb0bb07ae3ecf4820038bdf1170aa6f5"
    }
  },
  "timing": {
    "status": "draft",
    "notes": "qa_sync: критерий не пройден, статус оставлен draft. соло 7 из 60 (11,7 %), нужно не меньше 80 % в каждой группе, где она есть. Строка «текст не найден» в доказанные не входит. Причины: доказанных слов меньше доли строки 30, слово опровергнуто 12, расходится с субтитрами 10, выравниватель не справился 1. Отчёт: docs/analysis/karitas-qa.md.",
    "method": "mms-fa+whisperx"
  },
  "credits": [
    {
      "role": "Композитор и аранжировка",
      "name": "Sami Yusuf"
    },
    {
      "role": "Слова газели",
      "name": "Мухаммед Физули"
    },
    {
      "role": "Слова антифона",
      "name": "Хильдегарда Бингенская"
    },
    {
      "role": "Слова мавваля",
      "name": "Абу-ль-Хасан аш-Шуштари"
    },
    {
      "role": "Слова мавваля",
      "name": "Абд аль-Гани ан-Набулси"
    },
    {
      "role": "Хор",
      "name": "Cappella Amsterdam"
    },
    {
      "role": "Оркестр",
      "name": "Amsterdam Andalusian Orchestra"
    },
    {
      "role": "Мавваль ан-Набулси",
      "name": "Ahmed Elmaai"
    }
  ],
  "review": [
    "Время слов черновое: начало строки — реплика официальных субтитров, слова внутри разложены по слогам. Нужно измерение по голосу.",
    "Участки без реплики (2–37, 180–195, 281–291, 305–311, 319–325, 328–341, 355–363, 403–405, 550–632, 687–705, 714–721, 733–750, 760–813, 835–861, 872–879, 942–953, 961–977 с): слова, вокализ или чужой инструмент. В текст ничего не поставлено.",
    "Кто поёт газель, антифон, бейт аш-Шуштари и возгласы. На маввале ан-Набулси короткий ролик называет Ahmed Elmaai; поёт ли он и аш-Шуштари, не сказано.",
    "Кто играет соло эрху, уда, ная и скрипки и в какую секунду. Описание называет инструменты без времени, поэтому проигрыши не подписаны их именами.",
    "Автор бейта о терпении: релиз называет ан-Набулси, в его десяти бейтах строки нет. Строки помечены attribution-unverified.",
    "Арабское письмо газели Физули для поля alt не найдено, поле не заполнено.",
    "Страницы тома Догана 2000 и PDF антологии 1999 не открыты."
  ]
}
